# GO	NS	enrichment	name	ratio_in_study	ratio_in_pop	p_uncorrected	depth	study_count	p_fdr_bh	study_items
GO:0008017	MF	e	microtubule binding	13/39	44/6920	2.85468029077106e-20	5	13	7.385057912224733e-17	ASK1, BIK1, CIN8, DAD1, DAD2, DAM1, DUO1, NDC80, NUF2, SPC19, SPC24, SPC34, STU2
GO:0015631	MF	e	tubulin binding	13/39	53/6920	4.482460356643805e-19	4	13	5.798062471318761e-16	ASK1, BIK1, CIN8, DAD1, DAD2, DAM1, DUO1, NDC80, NUF2, SPC19, SPC24, SPC34, STU2
GO:0051010	MF	e	microtubule plus-end binding	8/39	15/6920	2.9639731690859584e-15	6	8	2.555932862808458e-12	ASK1, DAD1, DAD2, DAM1, DUO1, SPC19, SPC34, STU2
GO:0008092	MF	e	cytoskeletal protein binding	13/39	122/6920	4.585717469730891e-14	3	13	2.965812773548454e-11	ASK1, BIK1, CIN8, DAD1, DAD2, DAM1, DUO1, NDC80, NUF2, SPC19, SPC24, SPC34, STU2
GO:0005515	MF	e	protein binding	15/39	807/6920	1.4840998426897204e-05	2	15	0.007678732586076613	ASK1, BIK1, BUB1, BUB3, CIN8, DAD1, DAD2, DAM1, DUO1, NDC80, NUF2, SPC19, SPC24, SPC34, STU2
GO:0019237	MF	e	centromeric DNA binding	3/39	14/6920	5.77232766989529e-05	6	3	0.02488835280336519	CBF2, CEP3, MIF2
