# GO	NS	enrichment	name	ratio_in_study	ratio_in_pop	p_uncorrected	depth	study_count	p_fdr_bh	study_items
GO:0007017	BP	e	microtubule-based process	9/14	102/6920	4.325006932175013e-14	2	9	1.9834481790954608e-10	ARP1, BIK1, CIK1, DYN1, JNM1, KAR3, NUF2, STU1, STU2
GO:1902850	BP	e	microtubule cytoskeleton organization involved in mitosis	7/14	40/6920	4.13385583059725e-13	7	7	9.478931419559495e-10	ARP1, BIK1, DYN1, JNM1, NUF2, STU1, STU2
GO:0007097	BP	e	nuclear migration	6/14	23/6920	1.9586380186836003e-12	5	6	2.2455784884207477e-09	ARP1, BIK1, CIK1, DYN1, JNM1, KAR3
GO:0051647	BP	e	nucleus localization	6/14	23/6920	1.9586380186836003e-12	3	6	2.2455784884207477e-09	ARP1, BIK1, CIK1, DYN1, JNM1, KAR3
GO:0022402	BP	e	cell cycle process	12/14	622/6920	1.9372747551770326e-11	2	12	1.6024902457931288e-08	AME1, ARP1, BIK1, DYN1, JNM1, KAR3, NDC80, NUF2, SPC19, SPC34, STU1, STU2
GO:0000226	BP	e	microtubule cytoskeleton organization	7/14	68/6920	2.0965855810638407e-11	6	7	1.6024902457931288e-08	ARP1, BIK1, DYN1, JNM1, NUF2, STU1, STU2
GO:0008608	BP	e	attachment of spindle microtubules to kinetochore	6/14	35/6920	3.1119922745107854e-11	3	6	2.0387995101294945e-08	AME1, NDC80, NUF2, SPC19, SPC34, STU1
GO:0000741	BP	e	karyogamy	5/14	22/6920	3.919597773002551e-10	6	5	2.2469094233737125e-07	BIK1, CIK1, DYN1, KAR3, KAR5
GO:0070507	BP	e	regulation of microtubule cytoskeleton organization	5/14	25/6920	7.882214464435315e-10	7	5	4.016426170433373e-07	BIK1, CIK1, KAR3, SPC19, SPC34
GO:0007052	BP	e	mitotic spindle organization	5/14	26/6920	9.748327989224586e-10	8	5	4.470583215858395e-07	DYN1, JNM1, NUF2, STU1, STU2
GO:0032886	BP	e	regulation of microtubule-based process	5/14	27/6920	1.1950855760887228e-09	4	5	4.982420410857165e-07	BIK1, CIK1, KAR3, SPC19, SPC34
GO:0051301	BP	e	cell division	8/14	224/6920	2.7050896730105993e-09	2	8	1.033795103368884e-06	AME1, BIK1, KAR3, NDC80, NUF2, SPC19, SPC34, STU1
GO:0007051	BP	e	spindle organization	5/14	37/6920	6.38297884605749e-09	7	5	2.251718537539973e-06	DYN1, JNM1, NUF2, STU1, STU2
GO:0051294	BP	e	establishment of spindle orientation	4/14	13/6920	7.41956414888816e-09	8	4	2.268408079120073e-06	ARP1, BIK1, DYN1, JNM1
GO:0000132	BP	e	establishment of mitotic spindle orientation	4/14	13/6920	7.41956414888816e-09	9	4	2.268408079120073e-06	ARP1, BIK1, DYN1, JNM1
GO:0000742	BP	e	karyogamy involved in conjugation with cellular fusion	4/14	15/6920	1.4131849463169228e-08	7	4	4.05054135238088e-06	BIK1, CIK1, KAR3, KAR5
GO:0007010	BP	e	cytoskeleton organization	7/14	183/6920	2.3681169292587285e-08	5	7	6.263235005934509e-06	ARP1, BIK1, DYN1, JNM1, NUF2, STU1, STU2
GO:0040001	BP	e	establishment of mitotic spindle localization	4/14	17/6920	2.4583129111823193e-08	8	4	6.263235005934509e-06	ARP1, BIK1, DYN1, JNM1
GO:0051656	BP	e	establishment of organelle localization	6/14	110/6920	3.809949536772193e-08	3	6	7.0452820567179225e-06	ARP1, BIK1, CIK1, DYN1, JNM1, KAR3
GO:1903047	BP	e	mitotic cell cycle process	8/14	315/6920	3.991869464442826e-08	3	8	7.0452820567179225e-06	ARP1, BIK1, DYN1, JNM1, NDC80, NUF2, STU1, STU2
GO:0030473	BP	e	nuclear migration along microtubule	4/14	19/6920	3.994272426399171e-08	8	4	7.0452820567179225e-06	BIK1, CIK1, DYN1, KAR3
GO:0099111	BP	e	microtubule-based transport	4/14	19/6920	3.994272426399171e-08	4	4	7.0452820567179225e-06	BIK1, CIK1, DYN1, KAR3
GO:0010970	BP	e	transport along microtubule	4/14	19/6920	3.994272426399171e-08	6	4	7.0452820567179225e-06	BIK1, CIK1, DYN1, KAR3
GO:0051653	BP	e	spindle localization	4/14	19/6920	3.994272426399171e-08	3	4	7.0452820567179225e-06	ARP1, BIK1, DYN1, JNM1
GO:0051293	BP	e	establishment of spindle localization	4/14	19/6920	3.994272426399171e-08	7	4	7.0452820567179225e-06	ARP1, BIK1, DYN1, JNM1
GO:0072384	BP	e	organelle transport along microtubule	4/14	19/6920	3.994272426399171e-08	7	4	7.0452820567179225e-06	BIK1, CIK1, DYN1, KAR3
GO:0007059	BP	e	chromosome segregation	6/14	113/6920	4.480767748442212e-08	3	6	7.610666997909623e-06	BIK1, DYN1, NDC80, NUF2, SPC19, SPC34
GO:0006997	BP	e	nucleus organization	5/14	57/6920	5.999171263068324e-08	5	5	9.825785504439763e-06	BIK1, CIK1, DYN1, KAR3, KAR5
GO:0007018	BP	e	microtubule-based movement	4/14	22/6920	7.512051140964133e-08	3	4	1.1483422177487171e-05	BIK1, CIK1, DYN1, KAR3
GO:0030705	BP	e	cytoskeleton-dependent intracellular transport	4/14	22/6920	7.512051140964133e-08	5	4	1.1483422177487171e-05	BIK1, CIK1, DYN1, KAR3
GO:0000743	BP	e	nuclear migration involved in conjugation with cellular fusion	3/14	6/6920	1.314007054045655e-07	9	3	1.9438826935010884e-05	BIK1, CIK1, KAR3
GO:0051493	BP	e	regulation of cytoskeleton organization	5/14	93/6920	7.159199547965342e-07	6	5	0.0001026002785217783	BIK1, CIK1, KAR3, SPC19, SPC34
GO:0006996	BP	e	organelle organization	10/14	900/6920	8.069369790880977e-07	4	10	0.00011213978745751565	ARP1, BIK1, CIK1, DYN1, JNM1, KAR3, KAR5, NUF2, STU1, STU2
GO:0048284	BP	e	organelle fusion	5/14	100/6920	1.0291934591161891e-06	5	5	0.0001388200353972601	BIK1, CIK1, DYN1, KAR3, KAR5
GO:0051640	BP	e	organelle localization	6/14	193/6920	1.0857748411405983e-06	2	6	0.00014226752632773667	ARP1, BIK1, CIK1, DYN1, JNM1, KAR3
GO:0031113	BP	e	regulation of microtubule polymerization	3/14	15/6920	2.957421613935689e-06	9	3	0.00037674265337525197	BIK1, SPC19, SPC34
GO:0031110	BP	e	regulation of microtubule polymerization or depolymerization	3/14	17/6920	4.409341119008933e-06	8	3	0.000546519955993918	BIK1, SPC19, SPC34
GO:0032271	BP	e	regulation of protein polymerization	3/14	35/6920	4.1537236588137555e-05	6	3	0.005012888605084179	BIK1, SPC19, SPC34
GO:0060236	BP	e	regulation of mitotic spindle organization	2/14	7/6920	7.936497601478903e-05	9	2	0.009099194500095564	CIK1, KAR3
GO:0031109	BP	e	microtubule polymerization or depolymerization	2/14	7/6920	7.936497601478903e-05	7	2	0.009099194500095564	STU1, STU2
GO:0033043	BP	e	regulation of organelle organization	5/14	254/6920	9.768345080501828e-05	5	5	0.010926251351019848	BIK1, CIK1, KAR3, SPC19, SPC34
GO:0098813	BP	e	nuclear chromosome segregation	3/14	47/6920	0.00010144183353845758	4	3	0.011076482109699201	BIK1, DYN1, NUF2
GO:0090224	BP	e	regulation of spindle organization	2/14	8/6920	0.00010569761977402473	8	2	0.011272774053108777	CIK1, KAR3
GO:0010564	BP	e	regulation of cell cycle process	5/14	261/6920	0.00011115838708661387	5	5	0.011585735526800254	ARP1, CIK1, KAR3, SPC19, SPC34
GO:0031122	BP	e	cytoplasmic microtubule organization	2/14	9/6920	0.0001357398224755336	7	2	0.013833396130506602	DYN1, STU1
GO:0051315	BP	e	attachment of mitotic spindle microtubules to kinetochore	2/14	10/6920	0.0001694786158473211	4	2	0.016536785793102436	NDC80, NUF2
GO:0007020	BP	e	microtubule nucleation	2/14	10/6920	0.0001694786158473211	7	2	0.016536785793102436	BIK1, STU2
GO:0034501	BP	e	protein localization to kinetochore	2/14	11/6920	0.00020690106265204707	8	2	0.018702050014475474	AME1, NDC80
GO:0051987	BP	e	positive regulation of attachment of spindle microtubules to kinetochore	2/14	11/6920	0.00020690106265204707	8	2	0.018702050014475474	SPC19, SPC34
GO:1903083	BP	e	protein localization to condensed chromosome	2/14	11/6920	0.00020690106265204707	7	2	0.018702050014475474	AME1, NDC80
GO:0051726	BP	e	regulation of cell cycle	5/14	298/6920	0.00020798180347541414	4	5	0.018702050014475474	ARP1, CIK1, KAR3, SPC19, SPC34
GO:1902903	BP	e	regulation of supramolecular fiber organization	3/14	63/6920	0.00024372677075326765	5	3	0.02102327612061639	BIK1, SPC19, SPC34
GO:0051988	BP	e	regulation of attachment of spindle microtubules to kinetochore	2/14	12/6920	0.00024799425662706717	6	2	0.02102327612061639	SPC19, SPC34
GO:0051641	BP	e	cellular localization	8/14	1003/6920	0.0002521326181059532	2	8	0.02102327612061639	AME1, ARP1, BIK1, CIK1, DYN1, JNM1, KAR3, NDC80
GO:0031116	BP	e	positive regulation of microtubule polymerization	2/14	13/6920	0.0002927453224245729	10	2	0.02355315874805423	SPC19, SPC34
GO:0031112	BP	e	positive regulation of microtubule polymerization or depolymerization	2/14	13/6920	0.0002927453224245729	9	2	0.02355315874805423	SPC19, SPC34
GO:0051984	BP	e	positive regulation of chromosome segregation	2/14	14/6920	0.0003411414155518283	7	2	0.026461224717160583	SPC19, SPC34
GO:0032273	BP	e	positive regulation of protein polymerization	2/14	14/6920	0.0003411414155518283	7	2	0.026461224717160583	SPC19, SPC34
GO:0007049	BP	e	cell cycle	4/14	178/6920	0.0003462000617160129	2	4	0.026461224717160583	AME1, CIK1, KAR3, STU1
GO:0097435	BP	e	supramolecular fiber organization	3/14	78/6920	0.00045861423411630835	4	3	0.03447876848618672	DYN1, STU1, STU2
GO:0016043	BP	e	cellular component organization	10/14	1867/6920	0.0006588057695444219	3	10	0.04873037514726966	ARP1, BIK1, CIK1, DYN1, JNM1, KAR3, KAR5, NUF2, STU1, STU2
GO:0043254	BP	e	regulation of protein-containing complex assembly	3/14	89/6920	0.0006756527553384385	5	3	0.049183230729874274	BIK1, SPC19, SPC34
GO:0008152	BP	p	metabolic process	1/14	3843/6920	0.00021563318466876112	2	1	0.019017188170979585	KAR3
