# GO	NS	enrichment	name	ratio_in_study	ratio_in_pop	p_uncorrected	depth	study_count	p_fdr_bh	study_items
GO:0006388	BP	e	tRNA splicing, via endonucleolytic cleavage and ligation	5/8	9/6920	5.335913830049039e-14	9	5	1.2235250412302445e-10	SEN15, SEN2, SEN34, TPT1, TRL1
GO:0000394	BP	e	RNA splicing, via endonucleolytic cleavage and ligation	5/8	9/6920	5.335913830049039e-14	6	5	1.2235250412302445e-10	SEN15, SEN2, SEN34, TPT1, TRL1
GO:0000379	BP	e	tRNA-type intron splice site recognition and cleavage	4/8	5/6920	3.66463339716106e-12	5	4	5.60200291979354e-09	SEN15, SEN2, SEN34, SEN54
GO:0008033	BP	e	tRNA processing	7/8	141/6920	9.887142652687428e-12	8	7	1.1335609051306136e-08	SEN15, SEN2, SEN34, SEN54, STP1, TPT1, TRL1
GO:0006399	BP	e	tRNA metabolic process	7/8	218/6920	2.1819610419031969e-10	7	7	2.0012946676336123e-07	SEN15, SEN2, SEN34, SEN54, STP1, TPT1, TRL1
GO:0008380	BP	e	RNA splicing	5/8	155/6920	2.8047367804654454e-07	5	5	0.00021437538125357552	SEN15, SEN2, SEN34, TPT1, TRL1
GO:0006396	BP	e	RNA processing	7/8	687/6920	6.760183197164015e-07	4	7	0.0004428885734599168	SEN15, SEN2, SEN34, SEN54, STP1, TPT1, TRL1
GO:0016070	BP	e	RNA metabolic process	7/8	1035/6920	1.1451928157540513e-05	6	7	0.006564817816310099	SEN15, SEN2, SEN34, SEN54, STP1, TPT1, TRL1
