# GO	NS	enrichment	name	ratio_in_study	ratio_in_pop	p_uncorrected	depth	study_count	p_fdr_bh	study_items
GO:0003688	MF	e	DNA replication origin binding	6/6	39/6920	2.143899694576958e-14	6	6	5.5462685098705906e-11	ORC1, ORC2, ORC3, ORC4, ORC5, ORC6
GO:1990837	MF	e	sequence-specific double-stranded DNA binding	6/6	235/6920	1.4413601609850726e-09	5	6	1.8643993682341916e-06	ORC1, ORC2, ORC3, ORC4, ORC5, ORC6
GO:0003690	MF	e	double-stranded DNA binding	6/6	302/6920	6.586332742086863e-09	4	6	5.679614267926238e-06	ORC1, ORC2, ORC3, ORC4, ORC5, ORC6
GO:0043565	MF	e	sequence-specific DNA binding	6/6	317/6920	8.830606869384919e-09	4	6	5.7111949927746964e-06	ORC1, ORC2, ORC3, ORC4, ORC5, ORC6
GO:0003677	MF	e	DNA binding	6/6	676/6920	8.51769912667786e-07	3	6	0.00044070575281431246	ORC1, ORC2, ORC3, ORC4, ORC5, ORC6
