# GO	NS	enrichment	name	ratio_in_study	ratio_in_pop	p_uncorrected	depth	study_count	p_fdr_bh	study_items
GO:0005730	CC	e	nucleolus	7/7	365/6920	1.0752000904770063e-09	5	7	1.016064085500771e-06	DBP9, MAK21, MAK5, NOP4, RLP7, RSA3, YTM1
GO:0030687	CC	e	preribosome, large subunit precursor	4/7	59/6920	1.637000815256499e-07	4	4	7.734828852086957e-05	MAK21, RLP7, RSA3, YTM1
GO:0043232	CC	e	intracellular membraneless organelle	7/7	1210/6920	4.92631768085347e-06	4	7	0.0011638425521016322	DBP9, MAK21, MAK5, NOP4, RLP7, RSA3, YTM1
GO:0043228	CC	e	membraneless organelle	7/7	1210/6920	4.92631768085347e-06	3	7	0.0011638425521016322	DBP9, MAK21, MAK5, NOP4, RLP7, RSA3, YTM1
GO:0030684	CC	e	preribosome	4/7	163/6920	9.828766370850921e-06	3	4	0.0018576368440908241	MAK21, RLP7, RSA3, YTM1
